
*** Running vivado
    with args -log system_wrapper.vdi -applog -m64 -product Vivado -messageDb vivado.pb -mode batch -source system_wrapper.tcl -notrace


****** Vivado v2025.1 (64-bit)
  **** SW Build 6140274 on Wed May 21 22:58:25 MDT 2025
  **** IP Build 6138677 on Thu May 22 03:10:11 MDT 2025
  **** SharedData Build 6139179 on Tue May 20 17:58:58 MDT 2025
  **** Start of session at: Tue Dec  9 13:19:24 2025
    ** Copyright 1986-2022 Xilinx, Inc. All Rights Reserved.
    ** Copyright 2022-2025 Advanced Micro Devices, Inc. All Rights Reserved.

source system_wrapper.tcl -notrace
Command: open_checkpoint /home/student/s101153258/riscv_microprocessor/riscv_microprocessor.runs/impl_1/system_wrapper.dcp
INFO: [Device 21-403] Loading part xc7a100tcsg324-1
Netlist sorting complete. Time (s): cpu = 00:00:00.17 ; elapsed = 00:00:00.16 . Memory (MB): peak = 1823.066 ; gain = 0.000 ; free physical = 13523 ; free virtual = 37597
INFO: [Netlist 29-17] Analyzing 616 Unisim elements for replacement
INFO: [Netlist 29-28] Unisim Transformation completed in 0 CPU seconds
INFO: [Project 1-479] Netlist was created with Vivado 2025.1
INFO: [Project 1-570] Preparing netlist for logic optimization
Read ShapeDB Complete: Time (s): cpu = 00:00:00.01 ; elapsed = 00:00:00.01 . Memory (MB): peak = 1950.629 ; gain = 1.000 ; free physical = 13405 ; free virtual = 37480
INFO: [Timing 38-478] Restoring timing data from binary archive.
INFO: [Timing 38-479] Binary timing data restore complete.
INFO: [Project 1-856] Restoring constraints from binary archive.
INFO: [Project 1-853] Binary constraint restore complete.
INFO: [Designutils 20-5722] Start Reading Physical Databases.
Reading placement.
Read Netlist Cache: Time (s): cpu = 00:00:00 ; elapsed = 00:00:00 . Memory (MB): peak = 2435.051 ; gain = 0.000 ; free physical = 12924 ; free virtual = 36999
Reading placer database...
Read Device Cache: Time (s): cpu = 00:00:00.01 ; elapsed = 00:00:00 . Memory (MB): peak = 2435.051 ; gain = 0.000 ; free physical = 12924 ; free virtual = 36998
Read PlaceDB: Time (s): cpu = 00:00:00 ; elapsed = 00:00:00 . Memory (MB): peak = 2435.051 ; gain = 0.000 ; free physical = 12924 ; free virtual = 36998
Read PulsedLatchDB: Time (s): cpu = 00:00:00 ; elapsed = 00:00:00 . Memory (MB): peak = 2435.051 ; gain = 0.000 ; free physical = 12924 ; free virtual = 36998
Reading routing.
Read RouteStorage: Time (s): cpu = 00:00:00 ; elapsed = 00:00:00.01 . Memory (MB): peak = 2467.066 ; gain = 32.016 ; free physical = 12924 ; free virtual = 36998
Read Physdb Files: Time (s): cpu = 00:00:00.01 ; elapsed = 00:00:00.01 . Memory (MB): peak = 2467.066 ; gain = 32.016 ; free physical = 12924 ; free virtual = 36998
Restored from archive | CPU: 0.030000 secs | Memory: 1.128922 MB |
Finished XDEF File Restore: Time (s): cpu = 00:00:00.03 ; elapsed = 00:00:00.03 . Memory (MB): peak = 2467.066 ; gain = 32.016 ; free physical = 12924 ; free virtual = 36998
Netlist sorting complete. Time (s): cpu = 00:00:00.01 ; elapsed = 00:00:00 . Memory (MB): peak = 2467.066 ; gain = 0.000 ; free physical = 12924 ; free virtual = 36998
INFO: [Project 1-111] Unisim Transformation Summary:
  A total of 160 instances were transformed.
  RAM16X1D => RAM32X1D (RAMD32(x2)): 8 instances
  RAM32M => RAM32M (RAMD32(x6), RAMS32(x2)): 150 instances
  RAM32X1D => RAM32X1D (RAMD32(x2)): 2 instances

INFO: [Project 1-604] Checkpoint was created with Vivado v2025.1 (64-bit) build 6140274
open_checkpoint: Time (s): cpu = 00:00:13 ; elapsed = 00:00:08 . Memory (MB): peak = 2467.102 ; gain = 936.930 ; free physical = 12924 ; free virtual = 36998
Command: opt_design -directive Explore
INFO: [Vivado_Tcl 4-136] Directive used for opt_design is: Explore
Attempting to get a license for feature 'Implementation' and/or device 'xc7a100t'
INFO: [Common 17-349] Got license for feature 'Implementation' and/or device 'xc7a100t'
Running DRC as a precondition to command opt_design

Starting DRC Task
INFO: [DRC 23-27] Running DRC with 8 threads
INFO: [Project 1-461] DRC finished with 0 Errors
INFO: [Project 1-462] Please refer to the DRC report (report_drc) for more information.

Time (s): cpu = 00:00:01 ; elapsed = 00:00:00.32 . Memory (MB): peak = 2549.379 ; gain = 82.277 ; free physical = 12892 ; free virtual = 36967

Starting Logic Optimization Task

Phase 1 Initialization

Phase 1.1 Core Generation And Design Setup
Phase 1.1 Core Generation And Design Setup | Checksum: 2cefc2f80

Time (s): cpu = 00:00:00.01 ; elapsed = 00:00:00.01 . Memory (MB): peak = 2823.191 ; gain = 0.000 ; free physical = 12580 ; free virtual = 36654

Phase 1.2 Setup Constraints And Sort Netlist
Phase 1.2 Setup Constraints And Sort Netlist | Checksum: 2cefc2f80

Time (s): cpu = 00:00:00.01 ; elapsed = 00:00:00.02 . Memory (MB): peak = 2823.191 ; gain = 0.000 ; free physical = 12580 ; free virtual = 36654
Phase 1 Initialization | Checksum: 2cefc2f80

Time (s): cpu = 00:00:00.02 ; elapsed = 00:00:00.02 . Memory (MB): peak = 2823.191 ; gain = 0.000 ; free physical = 12580 ; free virtual = 36654

Phase 2 Timer Update And Timing Data Collection

Phase 2.1 Timer Update
INFO: [Timing 38-35] Done setting XDC timing constraints.
Phase 2.1 Timer Update | Checksum: 2cefc2f80

Time (s): cpu = 00:00:01 ; elapsed = 00:00:00.36 . Memory (MB): peak = 2922.004 ; gain = 98.812 ; free physical = 12564 ; free virtual = 36639

Phase 2.2 Timing Data Collection
Phase 2.2 Timing Data Collection | Checksum: 2cefc2f80

Time (s): cpu = 00:00:01 ; elapsed = 00:00:00.38 . Memory (MB): peak = 2922.004 ; gain = 98.812 ; free physical = 12557 ; free virtual = 36631
Phase 2 Timer Update And Timing Data Collection | Checksum: 2cefc2f80

Time (s): cpu = 00:00:01 ; elapsed = 00:00:00.38 . Memory (MB): peak = 2922.004 ; gain = 98.812 ; free physical = 12557 ; free virtual = 36631

Phase 3 Retarget
INFO: [Opt 31-1851] Number of loadless carry chains removed were: 0
INFO: [Opt 31-1834] Total Chains To Be Transformed Were: 0 AND Number of Transformed insts Created are: 0
INFO: [Opt 31-1566] Pulled 29 inverters resulting in an inversion of 208 pins
INFO: [Opt 31-138] Pushed 33 inverter(s) to 258 load pin(s).
INFO: [Opt 31-49] Retargeted 0 cell(s).
Phase 3 Retarget | Checksum: 2dc542c36

Time (s): cpu = 00:00:01 ; elapsed = 00:00:00.52 . Memory (MB): peak = 2922.004 ; gain = 98.812 ; free physical = 12557 ; free virtual = 36631
Retarget | Checksum: 2dc542c36
INFO: [Opt 31-389] Phase Retarget created 0 cells and removed 60 cells
INFO: [Opt 31-1021] In phase Retarget, 137 netlist objects are constrained preventing optimization. Please run opt_design with -debug_log to get more detail. 

Phase 4 Constant propagation
INFO: [Opt 31-138] Pushed 0 inverter(s) to 0 load pin(s).
Phase 4 Constant propagation | Checksum: 26d708895

Time (s): cpu = 00:00:01 ; elapsed = 00:00:00.57 . Memory (MB): peak = 2922.004 ; gain = 98.812 ; free physical = 12557 ; free virtual = 36631
Constant propagation | Checksum: 26d708895
INFO: [Opt 31-389] Phase Constant propagation created 0 cells and removed 28 cells
INFO: [Opt 31-1021] In phase Constant propagation, 120 netlist objects are constrained preventing optimization. Please run opt_design with -debug_log to get more detail. 

Phase 5 Sweep
INFO: [Constraints 18-11670] Building netlist checker database with flags, 0x8
Done building netlist checker database: Time (s): cpu = 00:00:00 ; elapsed = 00:00:00 . Memory (MB): peak = 2922.004 ; gain = 0.000 ; free physical = 12556 ; free virtual = 36631
INFO: [Constraints 18-11670] Building netlist checker database with flags, 0x8
Done building netlist checker database: Time (s): cpu = 00:00:00 ; elapsed = 00:00:00 . Memory (MB): peak = 2922.004 ; gain = 0.000 ; free physical = 12556 ; free virtual = 36631
Phase 5 Sweep | Checksum: 34cb3366c

Time (s): cpu = 00:00:02 ; elapsed = 00:00:00.94 . Memory (MB): peak = 2922.004 ; gain = 98.812 ; free physical = 12556 ; free virtual = 36631
Sweep | Checksum: 34cb3366c
INFO: [Opt 31-389] Phase Sweep created 16 cells and removed 228 cells
INFO: [Opt 31-1021] In phase Sweep, 150 netlist objects are constrained preventing optimization. Please run opt_design with -debug_log to get more detail. 

Phase 6 BUFG optimization
Phase 6 BUFG optimization | Checksum: 34cb3366c

Time (s): cpu = 00:00:02 ; elapsed = 00:00:01 . Memory (MB): peak = 2954.020 ; gain = 130.828 ; free physical = 12556 ; free virtual = 36631
BUFG optimization | Checksum: 34cb3366c
INFO: [Opt 31-662] Phase BUFG optimization created 0 cells of which 0 are BUFGs and removed 0 cells.

Phase 7 Shift Register Optimization
INFO: [Opt 31-1064] SRL Remap converted 0 SRLs to 0 registers and converted 0 registers of register chains to 0 SRLs
Phase 7 Shift Register Optimization | Checksum: 34cb3366c

Time (s): cpu = 00:00:02 ; elapsed = 00:00:01 . Memory (MB): peak = 2954.020 ; gain = 130.828 ; free physical = 12556 ; free virtual = 36631
Shift Register Optimization | Checksum: 34cb3366c
INFO: [Opt 31-389] Phase Shift Register Optimization created 0 cells and removed 0 cells
INFO: [Opt 31-1555] control_set_opt supports Versal devices only, and device 7a100t is unsupported

Phase 8 Post Processing Netlist
Phase 8 Post Processing Netlist | Checksum: 29643df04

Time (s): cpu = 00:00:02 ; elapsed = 00:00:01 . Memory (MB): peak = 2954.020 ; gain = 130.828 ; free physical = 12556 ; free virtual = 36631
Post Processing Netlist | Checksum: 29643df04
INFO: [Opt 31-389] Phase Post Processing Netlist created 0 cells and removed 0 cells
INFO: [Opt 31-1021] In phase Post Processing Netlist, 120 netlist objects are constrained preventing optimization. Please run opt_design with -debug_log to get more detail. 

Phase 9 Finalization

Phase 9.1 Finalizing Design Cores and Updating Shapes
Phase 9.1 Finalizing Design Cores and Updating Shapes | Checksum: 2eeb8fe61

Time (s): cpu = 00:00:02 ; elapsed = 00:00:01 . Memory (MB): peak = 2954.020 ; gain = 130.828 ; free physical = 12556 ; free virtual = 36631

Phase 9.2 Verifying Netlist Connectivity

Starting Connectivity Check Task

Time (s): cpu = 00:00:00.01 ; elapsed = 00:00:00.01 . Memory (MB): peak = 2954.020 ; gain = 0.000 ; free physical = 12556 ; free virtual = 36631
Phase 9.2 Verifying Netlist Connectivity | Checksum: 2eeb8fe61

Time (s): cpu = 00:00:02 ; elapsed = 00:00:01 . Memory (MB): peak = 2954.020 ; gain = 130.828 ; free physical = 12556 ; free virtual = 36631
Phase 9 Finalization | Checksum: 2eeb8fe61

Time (s): cpu = 00:00:02 ; elapsed = 00:00:01 . Memory (MB): peak = 2954.020 ; gain = 130.828 ; free physical = 12556 ; free virtual = 36631
Opt_design Change Summary
=========================


-------------------------------------------------------------------------------------------------------------------------
|  Phase                        |  #Cells created  |  #Cells Removed  |  #Constrained objects preventing optimizations  |
-------------------------------------------------------------------------------------------------------------------------
|  Retarget                     |               0  |              60  |                                            137  |
|  Constant propagation         |               0  |              28  |                                            120  |
|  Sweep                        |              16  |             228  |                                            150  |
|  BUFG optimization            |               0  |               0  |                                              0  |
|  Shift Register Optimization  |               0  |               0  |                                              0  |
|  Post Processing Netlist      |               0  |               0  |                                            120  |
-------------------------------------------------------------------------------------------------------------------------


Ending Logic Optimization Task | Checksum: 2eeb8fe61

Time (s): cpu = 00:00:02 ; elapsed = 00:00:01 . Memory (MB): peak = 2954.020 ; gain = 130.828 ; free physical = 12556 ; free virtual = 36631

Starting Netlist Obfuscation Task
Netlist sorting complete. Time (s): cpu = 00:00:00 ; elapsed = 00:00:00 . Memory (MB): peak = 2954.020 ; gain = 0.000 ; free physical = 12556 ; free virtual = 36631
Ending Netlist Obfuscation Task | Checksum: 2eeb8fe61

Time (s): cpu = 00:00:00 ; elapsed = 00:00:00.01 . Memory (MB): peak = 2954.020 ; gain = 0.000 ; free physical = 12556 ; free virtual = 36631
INFO: [Common 17-83] Releasing license: Implementation
39 Infos, 0 Warnings, 0 Critical Warnings and 0 Errors encountered.
opt_design completed successfully
INFO: [Vivado 12-24828] Executing command : report_drc -file system_wrapper_drc_opted.rpt -pb system_wrapper_drc_opted.pb -rpx system_wrapper_drc_opted.rpx
Command: report_drc -file system_wrapper_drc_opted.rpt -pb system_wrapper_drc_opted.pb -rpx system_wrapper_drc_opted.rpx
INFO: [IP_Flow 19-234] Refreshing IP repositories
INFO: [IP_Flow 19-1704] No user IP repositories specified
INFO: [IP_Flow 19-2313] Loaded Vivado IP repository '/opt/Xilinx/2025.1/Vivado/data/ip'.
INFO: [DRC 23-27] Running DRC with 8 threads
INFO: [Vivado_Tcl 2-168] The results of DRC are in file /home/student/s101153258/riscv_microprocessor/riscv_microprocessor.runs/impl_1/system_wrapper_drc_opted.rpt.
report_drc completed successfully
INFO: [Timing 38-480] Writing timing data to binary archive.
Wrote PlaceDB: Time (s): cpu = 00:00:00.01 ; elapsed = 00:00:00 . Memory (MB): peak = 2954.020 ; gain = 0.000 ; free physical = 12521 ; free virtual = 36596
Wrote PulsedLatchDB: Time (s): cpu = 00:00:00 ; elapsed = 00:00:00 . Memory (MB): peak = 2954.020 ; gain = 0.000 ; free physical = 12521 ; free virtual = 36596
Writing XDEF routing.
Write ShapeDB Complete: Time (s): cpu = 00:00:00.04 ; elapsed = 00:00:00.01 . Memory (MB): peak = 2954.020 ; gain = 0.000 ; free physical = 12521 ; free virtual = 36596
Writing XDEF routing logical nets.
Writing XDEF routing special nets.
Wrote RouteStorage: Time (s): cpu = 00:00:00.09 ; elapsed = 00:00:00.02 . Memory (MB): peak = 2954.020 ; gain = 0.000 ; free physical = 12521 ; free virtual = 36597
Wrote Netlist Cache: Time (s): cpu = 00:00:00.01 ; elapsed = 00:00:00 . Memory (MB): peak = 2954.020 ; gain = 0.000 ; free physical = 12521 ; free virtual = 36597
Wrote Device Cache: Time (s): cpu = 00:00:00.01 ; elapsed = 00:00:00 . Memory (MB): peak = 2954.020 ; gain = 0.000 ; free physical = 12521 ; free virtual = 36597
Write Physdb Complete: Time (s): cpu = 00:00:00.14 ; elapsed = 00:00:00.05 . Memory (MB): peak = 2954.020 ; gain = 0.000 ; free physical = 12519 ; free virtual = 36595
INFO: [Common 17-1381] The checkpoint '/home/student/s101153258/riscv_microprocessor/riscv_microprocessor.runs/impl_1/system_wrapper_opt.dcp' has been generated.
Command: place_design -directive Explore
Attempting to get a license for feature 'Implementation' and/or device 'xc7a100t'
INFO: [Common 17-349] Got license for feature 'Implementation' and/or device 'xc7a100t'
INFO: [Common 17-83] Releasing license: Implementation
INFO: [DRC 23-27] Running DRC with 8 threads
INFO: [Vivado_Tcl 4-198] DRC finished with 0 Errors
INFO: [Vivado_Tcl 4-199] Please refer to the DRC report (report_drc) for more information.
INFO: [Vivado_Tcl 4-2302] The placer was invoked with the 'Explore' directive.
Running DRC as a precondition to command place_design
INFO: [DRC 23-27] Running DRC with 8 threads
INFO: [Vivado_Tcl 4-198] DRC finished with 0 Errors
INFO: [Vivado_Tcl 4-199] Please refer to the DRC report (report_drc) for more information.
INFO: [Place 30-611] Multithreading enabled for place_design using a maximum of 8 CPUs

Starting Placer Task

Phase 1 Placer Initialization

Phase 1.1 Placer Initialization Netlist Sorting
Netlist sorting complete. Time (s): cpu = 00:00:00.01 ; elapsed = 00:00:00 . Memory (MB): peak = 2982.184 ; gain = 0.000 ; free physical = 12486 ; free virtual = 36564
Phase 1.1 Placer Initialization Netlist Sorting | Checksum: 2455fb4db

Time (s): cpu = 00:00:00.01 ; elapsed = 00:00:00 . Memory (MB): peak = 2982.184 ; gain = 0.000 ; free physical = 12486 ; free virtual = 36564
Netlist sorting complete. Time (s): cpu = 00:00:00 ; elapsed = 00:00:00.01 . Memory (MB): peak = 2982.184 ; gain = 0.000 ; free physical = 12486 ; free virtual = 36564

Phase 1.2 IO Placement/ Clock Placement/ Build Placer Device
INFO: [Timing 38-35] Done setting XDC timing constraints.
Phase 1.2 IO Placement/ Clock Placement/ Build Placer Device | Checksum: 19d84be35

Time (s): cpu = 00:00:01 ; elapsed = 00:00:00.56 . Memory (MB): peak = 3038.211 ; gain = 56.027 ; free physical = 12473 ; free virtual = 36550

Phase 1.3 Build Placer Netlist Model
Phase 1.3 Build Placer Netlist Model | Checksum: 2acd88cfe

Time (s): cpu = 00:00:04 ; elapsed = 00:00:02 . Memory (MB): peak = 3077.254 ; gain = 95.070 ; free physical = 12444 ; free virtual = 36522

Phase 1.4 Constrain Clocks/Macros
Phase 1.4 Constrain Clocks/Macros | Checksum: 2acd88cfe

Time (s): cpu = 00:00:04 ; elapsed = 00:00:02 . Memory (MB): peak = 3077.254 ; gain = 95.070 ; free physical = 12444 ; free virtual = 36522
Phase 1 Placer Initialization | Checksum: 2acd88cfe

Time (s): cpu = 00:00:04 ; elapsed = 00:00:02 . Memory (MB): peak = 3077.254 ; gain = 95.070 ; free physical = 12444 ; free virtual = 36522

Phase 2 Global Placement

Phase 2.1 Floorplanning
Phase 2.1 Floorplanning | Checksum: 248a64f42

Time (s): cpu = 00:00:05 ; elapsed = 00:00:02 . Memory (MB): peak = 3079.215 ; gain = 97.031 ; free physical = 12482 ; free virtual = 36560

Phase 2.2 Update Timing before SLR Path Opt
Phase 2.2 Update Timing before SLR Path Opt | Checksum: 294e67525

Time (s): cpu = 00:00:06 ; elapsed = 00:00:02 . Memory (MB): peak = 3079.215 ; gain = 97.031 ; free physical = 12486 ; free virtual = 36564

Phase 2.3 Post-Processing in Floorplanning
Phase 2.3 Post-Processing in Floorplanning | Checksum: 294e67525

Time (s): cpu = 00:00:06 ; elapsed = 00:00:02 . Memory (MB): peak = 3079.215 ; gain = 97.031 ; free physical = 12486 ; free virtual = 36564

Phase 2.4 Global Place Phase1
Phase 2.4 Global Place Phase1 | Checksum: 211757f82

Time (s): cpu = 00:00:20 ; elapsed = 00:00:06 . Memory (MB): peak = 3090.188 ; gain = 108.004 ; free physical = 12490 ; free virtual = 36568

Phase 2.5 Global Place Phase2

Phase 2.5.1 UpdateTiming Before Physical Synthesis
Phase 2.5.1 UpdateTiming Before Physical Synthesis | Checksum: 173a5f197

Time (s): cpu = 00:00:21 ; elapsed = 00:00:06 . Memory (MB): peak = 3090.188 ; gain = 108.004 ; free physical = 12489 ; free virtual = 36567

Phase 2.5.2 Physical Synthesis In Placer
INFO: [Physopt 32-1035] Found 0 LUTNM shape to break, 1357 LUT instances to create LUTNM shape
INFO: [Physopt 32-1044] Break lutnm for timing: one critical 0, two critical 0, total 0, new lutff created 0
INFO: [Physopt 32-1138] End 1 Pass. Optimized 578 nets or LUTs. Breaked 0 LUT, combined 578 existing LUTs and moved 0 existing LUT
INFO: [Physopt 32-65] No nets found for high-fanout optimization.
INFO: [Physopt 32-232] Optimized 0 net. Created 0 new instance.
INFO: [Physopt 32-775] End 1 Pass. Optimized 0 net or cell. Created 0 new cell, deleted 0 existing cell and moved 0 existing cell
INFO: [Physopt 32-456] No candidate cells for DSP register optimization found in the design.
INFO: [Physopt 32-775] End 2 Pass. Optimized 0 net or cell. Created 0 new cell, deleted 0 existing cell and moved 0 existing cell
INFO: [Physopt 32-1123] No candidate cells found for Shift Register to Pipeline optimization
INFO: [Physopt 32-775] End 2 Pass. Optimized 0 net or cell. Created 0 new cell, deleted 0 existing cell and moved 0 existing cell
INFO: [Physopt 32-1401] No candidate cells found for Shift Register optimization.
INFO: [Physopt 32-677] No candidate cells for Shift Register optimization found in the design
INFO: [Physopt 32-775] End 1 Pass. Optimized 0 net or cell. Created 0 new cell, deleted 0 existing cell and moved 0 existing cell
INFO: [Physopt 32-526] No candidate cells for BRAM register optimization found in the design
INFO: [Physopt 32-775] End 1 Pass. Optimized 0 net or cell. Created 0 new cell, deleted 0 existing cell and moved 0 existing cell
INFO: [Physopt 32-846] No candidate cells for URAM register optimization found in the design
INFO: [Physopt 32-775] End 1 Pass. Optimized 0 net or cell. Created 0 new cell, deleted 0 existing cell and moved 0 existing cell
INFO: [Physopt 32-846] No candidate cells for URAM register optimization found in the design
INFO: [Physopt 32-775] End 1 Pass. Optimized 0 net or cell. Created 0 new cell, deleted 0 existing cell and moved 0 existing cell
INFO: [Physopt 32-949] No candidate nets found for dynamic/static region interface net replication
INFO: [Physopt 32-775] End 1 Pass. Optimized 0 net or cell. Created 0 new cell, deleted 0 existing cell and moved 0 existing cell
Netlist sorting complete. Time (s): cpu = 00:00:00.01 ; elapsed = 00:00:00 . Memory (MB): peak = 3090.188 ; gain = 0.000 ; free physical = 12489 ; free virtual = 36567

Summary of Physical Synthesis Optimizations
============================================


-----------------------------------------------------------------------------------------------------------------------------------------------------------
|  Optimization                                     |  Added Cells  |  Removed Cells  |  Optimized Cells/Nets  |  Dont Touch  |  Iterations  |  Elapsed   |
-----------------------------------------------------------------------------------------------------------------------------------------------------------
|  LUT Combining                                    |            0  |            578  |                   578  |           0  |           1  |  00:00:00  |
|  Retime                                           |            0  |              0  |                     0  |           0  |           1  |  00:00:00  |
|  Very High Fanout                                 |            0  |              0  |                     0  |           0  |           1  |  00:00:00  |
|  DSP Register                                     |            0  |              0  |                     0  |           0  |           1  |  00:00:00  |
|  Shift Register to Pipeline                       |            0  |              0  |                     0  |           0  |           1  |  00:00:00  |
|  Shift Register                                   |            0  |              0  |                     0  |           0  |           1  |  00:00:00  |
|  BRAM Register                                    |            0  |              0  |                     0  |           0  |           1  |  00:00:00  |
|  URAM Register                                    |            0  |              0  |                     0  |           0  |           1  |  00:00:00  |
|  Dynamic/Static Region Interface Net Replication  |            0  |              0  |                     0  |           0  |           1  |  00:00:00  |
|  Total                                            |            0  |            578  |                   578  |           0  |           9  |  00:00:00  |
-----------------------------------------------------------------------------------------------------------------------------------------------------------


Phase 2.5.2 Physical Synthesis In Placer | Checksum: 139dfb44e

Time (s): cpu = 00:00:23 ; elapsed = 00:00:07 . Memory (MB): peak = 3090.188 ; gain = 108.004 ; free physical = 12469 ; free virtual = 36547
Phase 2.5 Global Place Phase2 | Checksum: 1b6140952

Time (s): cpu = 00:00:24 ; elapsed = 00:00:08 . Memory (MB): peak = 3090.188 ; gain = 108.004 ; free physical = 12469 ; free virtual = 36547
Phase 2 Global Placement | Checksum: 1b6140952

Time (s): cpu = 00:00:24 ; elapsed = 00:00:08 . Memory (MB): peak = 3090.188 ; gain = 108.004 ; free physical = 12469 ; free virtual = 36547

Phase 3 Detail Placement

Phase 3.1 Commit Multi Column Macros
Phase 3.1 Commit Multi Column Macros | Checksum: 2030cbfd7

Time (s): cpu = 00:00:25 ; elapsed = 00:00:08 . Memory (MB): peak = 3090.188 ; gain = 108.004 ; free physical = 12468 ; free virtual = 36546

Phase 3.2 Commit Most Macros & LUTRAMs
Phase 3.2 Commit Most Macros & LUTRAMs | Checksum: 24117dc1b

Time (s): cpu = 00:00:27 ; elapsed = 00:00:09 . Memory (MB): peak = 3090.188 ; gain = 108.004 ; free physical = 12468 ; free virtual = 36546

Phase 3.3 Area Swap Optimization
Phase 3.3 Area Swap Optimization | Checksum: 1a55e092d

Time (s): cpu = 00:00:27 ; elapsed = 00:00:09 . Memory (MB): peak = 3090.188 ; gain = 108.004 ; free physical = 12468 ; free virtual = 36546

Phase 3.4 Pipeline Register Optimization
Phase 3.4 Pipeline Register Optimization | Checksum: 208533cf1

Time (s): cpu = 00:00:27 ; elapsed = 00:00:09 . Memory (MB): peak = 3090.188 ; gain = 108.004 ; free physical = 12468 ; free virtual = 36546

Phase 3.5 Fast Optimization
Phase 3.5 Fast Optimization | Checksum: 281df534f

Time (s): cpu = 00:00:30 ; elapsed = 00:00:09 . Memory (MB): peak = 3090.188 ; gain = 108.004 ; free physical = 12477 ; free virtual = 36555

Phase 3.6 Small Shape Detail Placement
Phase 3.6 Small Shape Detail Placement | Checksum: 1a4e9e96a

Time (s): cpu = 00:00:33 ; elapsed = 00:00:11 . Memory (MB): peak = 3090.188 ; gain = 108.004 ; free physical = 12461 ; free virtual = 36539

Phase 3.7 Re-assign LUT pins
Phase 3.7 Re-assign LUT pins | Checksum: 1c8a4fb5f

Time (s): cpu = 00:00:33 ; elapsed = 00:00:12 . Memory (MB): peak = 3090.188 ; gain = 108.004 ; free physical = 12461 ; free virtual = 36539

Phase 3.8 Pipeline Register Optimization
Phase 3.8 Pipeline Register Optimization | Checksum: 24a4586a6

Time (s): cpu = 00:00:33 ; elapsed = 00:00:12 . Memory (MB): peak = 3090.188 ; gain = 108.004 ; free physical = 12461 ; free virtual = 36539
Phase 3 Detail Placement | Checksum: 24a4586a6

Time (s): cpu = 00:00:33 ; elapsed = 00:00:12 . Memory (MB): peak = 3090.188 ; gain = 108.004 ; free physical = 12461 ; free virtual = 36539

Phase 4 Post Placement Optimization and Clean-Up

Phase 4.1 Post Commit Optimization
INFO: [Timing 38-35] Done setting XDC timing constraints.

Phase 4.1.1 Post Placement Optimization
Post Placement Optimization Initialization | Checksum: 19e14463c

Phase 4.1.1.1 BUFG Insertion

Starting Physical Synthesis Task

Phase 1 Physical Synthesis Initialization
INFO: [Physopt 32-721] Multithreading enabled for phys_opt_design using a maximum of 8 CPUs
INFO: [Physopt 32-619] Estimated Timing Summary | WNS=0.282 | TNS=0.000 |
Phase 1 Physical Synthesis Initialization | Checksum: 138a7736d

Time (s): cpu = 00:00:00.5 ; elapsed = 00:00:00.1 . Memory (MB): peak = 3113.980 ; gain = 0.000 ; free physical = 12454 ; free virtual = 36532
INFO: [Place 46-33] Processed net system_i/rst_clk_wiz_100M/U0/mb_reset, BUFG insertion was skipped due to placement/routing conflicts.
INFO: [Place 46-56] BUFG insertion identified 1 candidate nets. Inserted BUFG: 0, Replicated BUFG Driver: 0, Skipped due to Placement/Routing Conflicts: 1, Skipped due to Timing Degradation: 0, Skipped due to netlist editing failed: 0.
Ending Physical Synthesis Task | Checksum: 2013c92a0

Time (s): cpu = 00:00:00.72 ; elapsed = 00:00:00.2 . Memory (MB): peak = 3113.980 ; gain = 0.000 ; free physical = 12454 ; free virtual = 36532
Phase 4.1.1.1 BUFG Insertion | Checksum: 19e14463c

Time (s): cpu = 00:00:37 ; elapsed = 00:00:13 . Memory (MB): peak = 3113.980 ; gain = 131.797 ; free physical = 12454 ; free virtual = 36532

Phase 4.1.1.2 Post Placement Timing Optimization
INFO: [Place 30-746] Post Placement Timing Summary WNS=0.515. For the most accurate timing information please run report_timing.
Phase 4.1.1.2 Post Placement Timing Optimization | Checksum: 24e214feb

Time (s): cpu = 00:00:37 ; elapsed = 00:00:13 . Memory (MB): peak = 3113.980 ; gain = 131.797 ; free physical = 12453 ; free virtual = 36531

Time (s): cpu = 00:00:37 ; elapsed = 00:00:13 . Memory (MB): peak = 3113.980 ; gain = 131.797 ; free physical = 12453 ; free virtual = 36531
Phase 4.1 Post Commit Optimization | Checksum: 24e214feb

Time (s): cpu = 00:00:37 ; elapsed = 00:00:13 . Memory (MB): peak = 3113.980 ; gain = 131.797 ; free physical = 12438 ; free virtual = 36516

Phase 4.2 Post Placement Cleanup
Phase 4.2 Post Placement Cleanup | Checksum: 24e214feb

Time (s): cpu = 00:00:38 ; elapsed = 00:00:13 . Memory (MB): peak = 3113.980 ; gain = 131.797 ; free physical = 12432 ; free virtual = 36510

Phase 4.3 Placer Reporting

Phase 4.3.1 Print Estimated Congestion
INFO: [Place 30-612] Post-Placement Estimated Congestion 
 ____________________________________________________
|           | Global Congestion | Short Congestion  |
| Direction | Region Size       | Region Size       |
|___________|___________________|___________________|
|      North|                1x1|                4x4|
|___________|___________________|___________________|
|      South|                1x1|                1x1|
|___________|___________________|___________________|
|       East|                1x1|                2x2|
|___________|___________________|___________________|
|       West|                1x1|                1x1|
|___________|___________________|___________________|

Phase 4.3.1 Print Estimated Congestion | Checksum: 24e214feb

Time (s): cpu = 00:00:38 ; elapsed = 00:00:13 . Memory (MB): peak = 3113.980 ; gain = 131.797 ; free physical = 12432 ; free virtual = 36510
Phase 4.3 Placer Reporting | Checksum: 24e214feb

Time (s): cpu = 00:00:38 ; elapsed = 00:00:13 . Memory (MB): peak = 3113.980 ; gain = 131.797 ; free physical = 12432 ; free virtual = 36510

Phase 4.4 Final Placement Cleanup
Netlist sorting complete. Time (s): cpu = 00:00:00 ; elapsed = 00:00:00 . Memory (MB): peak = 3113.980 ; gain = 0.000 ; free physical = 12432 ; free virtual = 36510

Time (s): cpu = 00:00:38 ; elapsed = 00:00:13 . Memory (MB): peak = 3113.980 ; gain = 131.797 ; free physical = 12432 ; free virtual = 36510
Phase 4 Post Placement Optimization and Clean-Up | Checksum: 2d7ad9916

Time (s): cpu = 00:00:38 ; elapsed = 00:00:13 . Memory (MB): peak = 3113.980 ; gain = 131.797 ; free physical = 12432 ; free virtual = 36510
Ending Placer Task | Checksum: 282f041b3

Time (s): cpu = 00:00:38 ; elapsed = 00:00:13 . Memory (MB): peak = 3113.980 ; gain = 131.797 ; free physical = 12432 ; free virtual = 36510
86 Infos, 0 Warnings, 0 Critical Warnings and 0 Errors encountered.
place_design completed successfully
place_design: Time (s): cpu = 00:00:40 ; elapsed = 00:00:14 . Memory (MB): peak = 3113.980 ; gain = 159.961 ; free physical = 12432 ; free virtual = 36510
INFO: [Vivado 12-24838] Running report commands "report_control_sets, report_io, report_utilization" in parallel.
Running report generation with 3 threads.
INFO: [Vivado 12-24828] Executing command : report_io -file system_wrapper_io_placed.rpt
report_io: Time (s): cpu = 00:00:00.15 ; elapsed = 00:00:00.09 . Memory (MB): peak = 3113.980 ; gain = 0.000 ; free physical = 12416 ; free virtual = 36494
INFO: [Vivado 12-24828] Executing command : report_control_sets -verbose -file system_wrapper_control_sets_placed.rpt
report_control_sets: Time (s): cpu = 00:00:00.18 ; elapsed = 00:00:00.1 . Memory (MB): peak = 3113.980 ; gain = 0.000 ; free physical = 12429 ; free virtual = 36507
INFO: [Vivado 12-24828] Executing command : report_utilization -file system_wrapper_utilization_placed.rpt -pb system_wrapper_utilization_placed.pb
INFO: [Timing 38-480] Writing timing data to binary archive.
Write ShapeDB Complete: Time (s): cpu = 00:00:00.13 ; elapsed = 00:00:00.03 . Memory (MB): peak = 3123.934 ; gain = 9.953 ; free physical = 12408 ; free virtual = 36490
Wrote PlaceDB: Time (s): cpu = 00:00:01 ; elapsed = 00:00:00.37 . Memory (MB): peak = 3123.934 ; gain = 9.953 ; free physical = 12389 ; free virtual = 36487
Wrote PulsedLatchDB: Time (s): cpu = 00:00:00 ; elapsed = 00:00:00 . Memory (MB): peak = 3123.934 ; gain = 0.000 ; free physical = 12386 ; free virtual = 36484
Writing XDEF routing.
Writing XDEF routing logical nets.
Writing XDEF routing special nets.
Wrote RouteStorage: Time (s): cpu = 00:00:00.03 ; elapsed = 00:00:00.01 . Memory (MB): peak = 3123.934 ; gain = 0.000 ; free physical = 12386 ; free virtual = 36484
Wrote Netlist Cache: Time (s): cpu = 00:00:00.02 ; elapsed = 00:00:00.01 . Memory (MB): peak = 3123.934 ; gain = 0.000 ; free physical = 12386 ; free virtual = 36485
Wrote Device Cache: Time (s): cpu = 00:00:00 ; elapsed = 00:00:00 . Memory (MB): peak = 3123.934 ; gain = 0.000 ; free physical = 12387 ; free virtual = 36487
Write Physdb Complete: Time (s): cpu = 00:00:01 ; elapsed = 00:00:00.53 . Memory (MB): peak = 3123.934 ; gain = 9.953 ; free physical = 12387 ; free virtual = 36488
INFO: [Common 17-1381] The checkpoint '/home/student/s101153258/riscv_microprocessor/riscv_microprocessor.runs/impl_1/system_wrapper_placed.dcp' has been generated.
Command: phys_opt_design -directive Explore
Attempting to get a license for feature 'Implementation' and/or device 'xc7a100t'
INFO: [Common 17-349] Got license for feature 'Implementation' and/or device 'xc7a100t'
INFO: [Vivado_Tcl 4-137] Directive used for phys_opt_design is: Explore

Starting Initial Update Timing Task

Time (s): cpu = 00:00:02 ; elapsed = 00:00:00.58 . Memory (MB): peak = 3123.934 ; gain = 0.000 ; free physical = 12374 ; free virtual = 36458
INFO: [Vivado_Tcl 4-2279] Estimated Timing Summary | WNS= 0.515 | TNS= 0.000 | 
INFO: [Vivado_Tcl 4-383] Design worst setup slack (WNS) is greater than or equal to 0.000 ns. All physical synthesis setup optimizations will be skipped.
INFO: [Vivado_Tcl 4-232] No setup violation found. The netlist was not modified.
INFO: [Common 17-83] Releasing license: Implementation
98 Infos, 0 Warnings, 0 Critical Warnings and 0 Errors encountered.
phys_opt_design completed successfully
INFO: [Timing 38-480] Writing timing data to binary archive.
Write ShapeDB Complete: Time (s): cpu = 00:00:00.17 ; elapsed = 00:00:00.04 . Memory (MB): peak = 3142.793 ; gain = 15.891 ; free physical = 12378 ; free virtual = 36465
Wrote PlaceDB: Time (s): cpu = 00:00:01 ; elapsed = 00:00:00.42 . Memory (MB): peak = 3142.793 ; gain = 15.891 ; free physical = 12362 ; free virtual = 36466
Wrote PulsedLatchDB: Time (s): cpu = 00:00:00 ; elapsed = 00:00:00 . Memory (MB): peak = 3142.793 ; gain = 0.000 ; free physical = 12359 ; free virtual = 36463
Writing XDEF routing.
Writing XDEF routing logical nets.
Writing XDEF routing special nets.
Wrote RouteStorage: Time (s): cpu = 00:00:00.02 ; elapsed = 00:00:00.02 . Memory (MB): peak = 3142.793 ; gain = 0.000 ; free physical = 12359 ; free virtual = 36464
Wrote Netlist Cache: Time (s): cpu = 00:00:00.01 ; elapsed = 00:00:00 . Memory (MB): peak = 3142.793 ; gain = 0.000 ; free physical = 12359 ; free virtual = 36464
Wrote Device Cache: Time (s): cpu = 00:00:00 ; elapsed = 00:00:00.01 . Memory (MB): peak = 3142.793 ; gain = 0.000 ; free physical = 12359 ; free virtual = 36465
Write Physdb Complete: Time (s): cpu = 00:00:01 ; elapsed = 00:00:00.57 . Memory (MB): peak = 3142.793 ; gain = 15.891 ; free physical = 12359 ; free virtual = 36465
INFO: [Common 17-1381] The checkpoint '/home/student/s101153258/riscv_microprocessor/riscv_microprocessor.runs/impl_1/system_wrapper_physopt.dcp' has been generated.
Command: route_design -directive Explore -tns_cleanup
Attempting to get a license for feature 'Implementation' and/or device 'xc7a100t'
INFO: [Common 17-349] Got license for feature 'Implementation' and/or device 'xc7a100t'


Starting Routing Task
INFO: [Route 35-270] Using Router directive 'Explore'.
INFO: [Route 35-254] Multithreading enabled for route_design using a maximum of 8 CPUs

Phase 1 Build RT Design
Checksum: PlaceDB: fe746c2d ConstDB: 0 ShapeSum: d2a975f0 RouteDB: b1d25f96
Post Restoration Checksum: NetGraph: e77732f1 | NumContArr: 1834f830 | Constraints: c2a8fa9d | Timing: c2a8fa9d
Phase 1 Build RT Design | Checksum: 284fe205b

Time (s): cpu = 00:00:15 ; elapsed = 00:00:11 . Memory (MB): peak = 3264.754 ; gain = 121.961 ; free physical = 12239 ; free virtual = 36328

Phase 2 Router Initialization

Phase 2.1 Fix Topology Constraints
Phase 2.1 Fix Topology Constraints | Checksum: 284fe205b

Time (s): cpu = 00:00:15 ; elapsed = 00:00:11 . Memory (MB): peak = 3264.754 ; gain = 121.961 ; free physical = 12239 ; free virtual = 36328

Phase 2.2 Pre Route Cleanup
Phase 2.2 Pre Route Cleanup | Checksum: 284fe205b

Time (s): cpu = 00:00:15 ; elapsed = 00:00:11 . Memory (MB): peak = 3264.754 ; gain = 121.961 ; free physical = 12239 ; free virtual = 36328
 Number of Nodes with overlaps = 0

Phase 2.3 Update Timing
Phase 2.3 Update Timing | Checksum: 23e6dc23a

Time (s): cpu = 00:00:19 ; elapsed = 00:00:12 . Memory (MB): peak = 3312.020 ; gain = 169.227 ; free physical = 12197 ; free virtual = 36286
INFO: [Route 35-416] Intermediate Timing Summary | WNS=0.814  | TNS=0.000  | WHS=-0.255 | THS=-667.316|


Phase 2.4 Soft Constraint Pins - Fast Budgeting
Phase 2.4 Soft Constraint Pins - Fast Budgeting | Checksum: 27c11573f

Time (s): cpu = 00:00:21 ; elapsed = 00:00:13 . Memory (MB): peak = 3328.082 ; gain = 185.289 ; free physical = 12190 ; free virtual = 36279

Router Utilization Summary
  Global Vertical Routing Utilization    = 0 %
  Global Horizontal Routing Utilization  = 0 %
  Routable Net Status*
  *Does not include unroutable nets such as driverless and loadless.
  Run report_route_status for detailed report.
  Number of Failed Nets               = 12426
    (Failed Nets is the sum of unrouted and partially routed nets)
  Number of Unrouted Nets             = 12426
  Number of Partially Routed Nets     = 0
  Number of Node Overlaps             = 0

Phase 2 Router Initialization | Checksum: 2a77f6f99

Time (s): cpu = 00:00:21 ; elapsed = 00:00:13 . Memory (MB): peak = 3328.082 ; gain = 185.289 ; free physical = 12190 ; free virtual = 36279

Phase 3 Global Routing
Phase 3 Global Routing | Checksum: 2a77f6f99

Time (s): cpu = 00:00:21 ; elapsed = 00:00:13 . Memory (MB): peak = 3328.082 ; gain = 185.289 ; free physical = 12190 ; free virtual = 36279

Phase 4 Initial Routing

Phase 4.1 Initial Net Routing Pass
Phase 4.1 Initial Net Routing Pass | Checksum: 2db919f47

Time (s): cpu = 00:00:24 ; elapsed = 00:00:13 . Memory (MB): peak = 3328.082 ; gain = 185.289 ; free physical = 12190 ; free virtual = 36279
Phase 4 Initial Routing | Checksum: 2db919f47

Time (s): cpu = 00:00:24 ; elapsed = 00:00:13 . Memory (MB): peak = 3328.082 ; gain = 185.289 ; free physical = 12190 ; free virtual = 36279

Phase 5 Rip-up And Reroute

Phase 5.1 Global Iteration 0
 Number of Nodes with overlaps = 3662
 Number of Nodes with overlaps = 1428
 Number of Nodes with overlaps = 665
 Number of Nodes with overlaps = 329
 Number of Nodes with overlaps = 130
 Number of Nodes with overlaps = 84
 Number of Nodes with overlaps = 19
 Number of Nodes with overlaps = 13
 Number of Nodes with overlaps = 2
 Number of Nodes with overlaps = 7
 Number of Nodes with overlaps = 4
 Number of Nodes with overlaps = 1
 Number of Nodes with overlaps = 1
 Number of Nodes with overlaps = 2
 Number of Nodes with overlaps = 2
 Number of Nodes with overlaps = 0
INFO: [Route 35-416] Intermediate Timing Summary | WNS=-0.253 | TNS=-2.025 | WHS=N/A    | THS=N/A    |

Phase 5.1 Global Iteration 0 | Checksum: 1c630671f

Time (s): cpu = 00:00:58 ; elapsed = 00:00:26 . Memory (MB): peak = 3336.082 ; gain = 193.289 ; free physical = 12174 ; free virtual = 36263

Phase 5.2 Global Iteration 1
 Number of Nodes with overlaps = 1374
 Number of Nodes with overlaps = 644
 Number of Nodes with overlaps = 191
 Number of Nodes with overlaps = 75
 Number of Nodes with overlaps = 62
 Number of Nodes with overlaps = 29
 Number of Nodes with overlaps = 17
 Number of Nodes with overlaps = 9
 Number of Nodes with overlaps = 11
 Number of Nodes with overlaps = 5
 Number of Nodes with overlaps = 5
 Number of Nodes with overlaps = 7
 Number of Nodes with overlaps = 3
 Number of Nodes with overlaps = 2
 Number of Nodes with overlaps = 0
INFO: [Route 35-416] Intermediate Timing Summary | WNS=-0.121 | TNS=-0.199 | WHS=N/A    | THS=N/A    |

Phase 5.2 Global Iteration 1 | Checksum: 1fd51187c

Time (s): cpu = 00:01:19 ; elapsed = 00:00:37 . Memory (MB): peak = 3336.082 ; gain = 193.289 ; free physical = 12197 ; free virtual = 36288

Phase 5.3 Global Iteration 2
 Number of Nodes with overlaps = 1396
 Number of Nodes with overlaps = 676
 Number of Nodes with overlaps = 301
 Number of Nodes with overlaps = 136
 Number of Nodes with overlaps = 57
 Number of Nodes with overlaps = 35
 Number of Nodes with overlaps = 24
 Number of Nodes with overlaps = 18
 Number of Nodes with overlaps = 5
 Number of Nodes with overlaps = 2
 Number of Nodes with overlaps = 8
 Number of Nodes with overlaps = 1
 Number of Nodes with overlaps = 6
 Number of Nodes with overlaps = 1
 Number of Nodes with overlaps = 7
 Number of Nodes with overlaps = 4
 Number of Nodes with overlaps = 2
 Number of Nodes with overlaps = 0
INFO: [Route 35-416] Intermediate Timing Summary | WNS=0.001  | TNS=0.000  | WHS=N/A    | THS=N/A    |

Phase 5.3 Global Iteration 2 | Checksum: 14e302646

Time (s): cpu = 00:01:43 ; elapsed = 00:00:49 . Memory (MB): peak = 3336.082 ; gain = 193.289 ; free physical = 12187 ; free virtual = 36279
Phase 5 Rip-up And Reroute | Checksum: 14e302646

Time (s): cpu = 00:01:43 ; elapsed = 00:00:49 . Memory (MB): peak = 3336.082 ; gain = 193.289 ; free physical = 12187 ; free virtual = 36279

Phase 6 Delay and Skew Optimization

Phase 6.1 TNS Cleanup

Phase 6.1.1 Delay CleanUp
Phase 6.1.1 Delay CleanUp | Checksum: 14e302646

Time (s): cpu = 00:01:44 ; elapsed = 00:00:49 . Memory (MB): peak = 3336.082 ; gain = 193.289 ; free physical = 12187 ; free virtual = 36279
Phase 6.1 TNS Cleanup | Checksum: 14e302646

Time (s): cpu = 00:01:44 ; elapsed = 00:00:49 . Memory (MB): peak = 3336.082 ; gain = 193.289 ; free physical = 12187 ; free virtual = 36279

Phase 6.2 Clock Skew Optimization
Phase 6.2 Clock Skew Optimization | Checksum: 14e302646

Time (s): cpu = 00:01:44 ; elapsed = 00:00:49 . Memory (MB): peak = 3336.082 ; gain = 193.289 ; free physical = 12187 ; free virtual = 36279
Phase 6 Delay and Skew Optimization | Checksum: 14e302646

Time (s): cpu = 00:01:44 ; elapsed = 00:00:49 . Memory (MB): peak = 3336.082 ; gain = 193.289 ; free physical = 12187 ; free virtual = 36279

Phase 7 Post Hold Fix

Phase 7.1 Hold Fix Iter
INFO: [Route 35-416] Intermediate Timing Summary | WNS=0.080  | TNS=0.000  | WHS=0.019  | THS=0.000  |

Phase 7.1 Hold Fix Iter | Checksum: 12d0ec58e

Time (s): cpu = 00:01:44 ; elapsed = 00:00:49 . Memory (MB): peak = 3336.082 ; gain = 193.289 ; free physical = 12187 ; free virtual = 36279
Phase 7 Post Hold Fix | Checksum: 12d0ec58e

Time (s): cpu = 00:01:44 ; elapsed = 00:00:49 . Memory (MB): peak = 3336.082 ; gain = 193.289 ; free physical = 12187 ; free virtual = 36279

Phase 8 Route finalize

Router Utilization Summary
  Global Vertical Routing Utilization    = 2.5022 %
  Global Horizontal Routing Utilization  = 3.12262 %
  Routable Net Status*
  *Does not include unroutable nets such as driverless and loadless.
  Run report_route_status for detailed report.
  Number of Failed Nets               = 0
    (Failed Nets is the sum of unrouted and partially routed nets)
  Number of Unrouted Nets             = 0
  Number of Partially Routed Nets     = 0
  Number of Node Overlaps             = 0

Phase 8 Route finalize | Checksum: 12d0ec58e

Time (s): cpu = 00:01:45 ; elapsed = 00:00:49 . Memory (MB): peak = 3336.082 ; gain = 193.289 ; free physical = 12187 ; free virtual = 36279

Phase 9 Verifying routed nets

 Verification completed successfully
Phase 9 Verifying routed nets | Checksum: 12d0ec58e

Time (s): cpu = 00:01:45 ; elapsed = 00:00:49 . Memory (MB): peak = 3336.082 ; gain = 193.289 ; free physical = 12187 ; free virtual = 36279

Phase 10 Depositing Routes
Phase 10 Depositing Routes | Checksum: 149ed3d19

Time (s): cpu = 00:01:45 ; elapsed = 00:00:49 . Memory (MB): peak = 3336.082 ; gain = 193.289 ; free physical = 12182 ; free virtual = 36273

Phase 11 Post Process Routing
Phase 11 Post Process Routing | Checksum: 149ed3d19

Time (s): cpu = 00:01:45 ; elapsed = 00:00:49 . Memory (MB): peak = 3336.082 ; gain = 193.289 ; free physical = 12175 ; free virtual = 36266

Phase 12 Post Router Timing
INFO: [Route 35-20] Post Routing Timing Summary | WNS=0.086  | TNS=0.000  | WHS=0.019  | THS=0.000  |

Phase 12 Post Router Timing | Checksum: 1fbbb3424

Time (s): cpu = 00:01:49 ; elapsed = 00:00:50 . Memory (MB): peak = 3336.082 ; gain = 193.289 ; free physical = 12191 ; free virtual = 36283
INFO: [Route 35-61] The design met the timing requirement.
Total Elapsed time in route_design: 49.85 secs

Phase 13 Post-Route Event Processing
Phase 13 Post-Route Event Processing | Checksum: 1fd1e345c

Time (s): cpu = 00:01:49 ; elapsed = 00:00:50 . Memory (MB): peak = 3336.082 ; gain = 193.289 ; free physical = 12191 ; free virtual = 36283
INFO: [Route 35-16] Router Completed Successfully
Ending Routing Task | Checksum: 1fd1e345c

Time (s): cpu = 00:01:49 ; elapsed = 00:00:50 . Memory (MB): peak = 3336.082 ; gain = 193.289 ; free physical = 12191 ; free virtual = 36283

Routing Is Done.
INFO: [Common 17-83] Releasing license: Implementation
112 Infos, 0 Warnings, 0 Critical Warnings and 0 Errors encountered.
route_design completed successfully
route_design: Time (s): cpu = 00:01:49 ; elapsed = 00:00:50 . Memory (MB): peak = 3336.082 ; gain = 193.289 ; free physical = 12191 ; free virtual = 36283
INFO: [Vivado 12-24828] Executing command : report_drc -file system_wrapper_drc_routed.rpt -pb system_wrapper_drc_routed.pb -rpx system_wrapper_drc_routed.rpx
Command: report_drc -file system_wrapper_drc_routed.rpt -pb system_wrapper_drc_routed.pb -rpx system_wrapper_drc_routed.rpx
INFO: [IP_Flow 19-1839] IP Catalog is up to date.
INFO: [DRC 23-27] Running DRC with 8 threads
INFO: [Vivado_Tcl 2-168] The results of DRC are in file /home/student/s101153258/riscv_microprocessor/riscv_microprocessor.runs/impl_1/system_wrapper_drc_routed.rpt.
report_drc completed successfully
INFO: [Vivado 12-24828] Executing command : report_methodology -file system_wrapper_methodology_drc_routed.rpt -pb system_wrapper_methodology_drc_routed.pb -rpx system_wrapper_methodology_drc_routed.rpx
Command: report_methodology -file system_wrapper_methodology_drc_routed.rpt -pb system_wrapper_methodology_drc_routed.pb -rpx system_wrapper_methodology_drc_routed.rpx
INFO: [Timing 38-35] Done setting XDC timing constraints.
INFO: [DRC 23-133] Running Methodology with 8 threads
INFO: [Vivado_Tcl 2-1520] The results of Report Methodology are in file /home/student/s101153258/riscv_microprocessor/riscv_microprocessor.runs/impl_1/system_wrapper_methodology_drc_routed.rpt.
report_methodology completed successfully
INFO: [Vivado 12-24828] Executing command : report_timing_summary -max_paths 10 -routable_nets -report_unconstrained -file system_wrapper_timing_summary_routed.rpt -pb system_wrapper_timing_summary_routed.pb -rpx system_wrapper_timing_summary_routed.rpx
INFO: [Timing 38-35] Done setting XDC timing constraints.
INFO: [Timing 38-91] UpdateTimingParams: Speed grade: -1, Delay Type: min_max.
INFO: [Timing 38-191] Multithreading enabled for timing update using a maximum of 8 CPUs
INFO: [Vivado 12-24838] Running report commands "report_bus_skew, report_incremental_reuse, report_route_status" in parallel.
Running report generation with 3 threads.
INFO: [Vivado 12-24828] Executing command : report_incremental_reuse -file system_wrapper_incremental_reuse_routed.rpt
INFO: [Vivado_Tcl 4-1062] Incremental flow is disabled. No incremental reuse Info to report.
INFO: [Vivado 12-24828] Executing command : report_bus_skew -warn_on_violation -file system_wrapper_bus_skew_routed.rpt -pb system_wrapper_bus_skew_routed.pb -rpx system_wrapper_bus_skew_routed.rpx
INFO: [Timing 38-91] UpdateTimingParams: Speed grade: -1, Delay Type: min_max.
INFO: [Timing 38-191] Multithreading enabled for timing update using a maximum of 8 CPUs
INFO: [Vivado 12-24828] Executing command : report_route_status -file system_wrapper_route_status.rpt -pb system_wrapper_route_status.pb
INFO: [Vivado 12-24828] Executing command : report_power -file system_wrapper_power_routed.rpt -pb system_wrapper_power_summary_routed.pb -rpx system_wrapper_power_routed.rpx
Command: report_power -file system_wrapper_power_routed.rpt -pb system_wrapper_power_summary_routed.pb -rpx system_wrapper_power_routed.rpx
Running Vector-less Activity Propagation...

Finished Running Vector-less Activity Propagation
132 Infos, 0 Warnings, 0 Critical Warnings and 0 Errors encountered.
report_power completed successfully
INFO: [Vivado 12-24828] Executing command : report_clock_utilization -file system_wrapper_clock_utilization_routed.rpt
generate_parallel_reports: Time (s): cpu = 00:00:23 ; elapsed = 00:00:06 . Memory (MB): peak = 3395.078 ; gain = 58.996 ; free physical = 12145 ; free virtual = 36247
INFO: [Timing 38-480] Writing timing data to binary archive.
Write ShapeDB Complete: Time (s): cpu = 00:00:00.11 ; elapsed = 00:00:00.03 . Memory (MB): peak = 3395.078 ; gain = 0.000 ; free physical = 12146 ; free virtual = 36250
Wrote PlaceDB: Time (s): cpu = 00:00:01 ; elapsed = 00:00:00.36 . Memory (MB): peak = 3395.078 ; gain = 0.000 ; free physical = 12143 ; free virtual = 36264
Wrote PulsedLatchDB: Time (s): cpu = 00:00:00 ; elapsed = 00:00:00 . Memory (MB): peak = 3395.078 ; gain = 0.000 ; free physical = 12143 ; free virtual = 36265
Writing XDEF routing.
Writing XDEF routing logical nets.
Writing XDEF routing special nets.
Wrote RouteStorage: Time (s): cpu = 00:00:00.13 ; elapsed = 00:00:00.07 . Memory (MB): peak = 3395.078 ; gain = 0.000 ; free physical = 12141 ; free virtual = 36265
Wrote Netlist Cache: Time (s): cpu = 00:00:00.01 ; elapsed = 00:00:00.01 . Memory (MB): peak = 3395.078 ; gain = 0.000 ; free physical = 12141 ; free virtual = 36266
Wrote Device Cache: Time (s): cpu = 00:00:00 ; elapsed = 00:00:00 . Memory (MB): peak = 3395.078 ; gain = 0.000 ; free physical = 12141 ; free virtual = 36266
Write Physdb Complete: Time (s): cpu = 00:00:01 ; elapsed = 00:00:00.61 . Memory (MB): peak = 3395.078 ; gain = 0.000 ; free physical = 12141 ; free virtual = 36266
INFO: [Common 17-1381] The checkpoint '/home/student/s101153258/riscv_microprocessor/riscv_microprocessor.runs/impl_1/system_wrapper_routed.dcp' has been generated.
Command: phys_opt_design -directive Explore
Attempting to get a license for feature 'Implementation' and/or device 'xc7a100t'
INFO: [Common 17-349] Got license for feature 'Implementation' and/or device 'xc7a100t'
INFO: [Vivado_Tcl 4-241] Physical synthesis in post route mode 
INFO: [Vivado_Tcl 4-137] Directive used for phys_opt_design is: Explore
INFO: [Vivado_Tcl 4-2279] Estimated Timing Summary | WNS= 0.086 | TNS= 0.000 | 
INFO: [Vivado_Tcl 4-383] Design worst setup slack (WNS) is greater than or equal to 0.000 ns. All physical synthesis setup optimizations will be skipped.
INFO: [Vivado_Tcl 4-232] No setup violation found. The netlist was not modified.
INFO: [Common 17-83] Releasing license: Implementation
142 Infos, 0 Warnings, 0 Critical Warnings and 0 Errors encountered.
phys_opt_design completed successfully
INFO: [Vivado 12-24828] Executing command : report_timing_summary -max_paths 10 -report_unconstrained -warn_on_violation -file system_wrapper_timing_summary_postroute_physopted.rpt -pb system_wrapper_timing_summary_postroute_physopted.pb -rpx system_wrapper_timing_summary_postroute_physopted.rpx
INFO: [Timing 38-91] UpdateTimingParams: Speed grade: -1, Delay Type: min_max.
INFO: [Timing 38-191] Multithreading enabled for timing update using a maximum of 8 CPUs
INFO: [Vivado 12-24828] Executing command : report_bus_skew -warn_on_violation -file system_wrapper_bus_skew_postroute_physopted.rpt -pb system_wrapper_bus_skew_postroute_physopted.pb -rpx system_wrapper_bus_skew_postroute_physopted.rpx
INFO: [Timing 38-91] UpdateTimingParams: Speed grade: -1, Delay Type: min_max.
INFO: [Timing 38-191] Multithreading enabled for timing update using a maximum of 8 CPUs
INFO: [Timing 38-480] Writing timing data to binary archive.
Write ShapeDB Complete: Time (s): cpu = 00:00:00.1 ; elapsed = 00:00:00.02 . Memory (MB): peak = 3395.078 ; gain = 0.000 ; free physical = 12142 ; free virtual = 36254
Wrote PlaceDB: Time (s): cpu = 00:00:01 ; elapsed = 00:00:00.37 . Memory (MB): peak = 3395.078 ; gain = 0.000 ; free physical = 12119 ; free virtual = 36247
Wrote PulsedLatchDB: Time (s): cpu = 00:00:00 ; elapsed = 00:00:00 . Memory (MB): peak = 3395.078 ; gain = 0.000 ; free physical = 12118 ; free virtual = 36247
Writing XDEF routing.
Writing XDEF routing logical nets.
Writing XDEF routing special nets.
Wrote RouteStorage: Time (s): cpu = 00:00:00.14 ; elapsed = 00:00:00.08 . Memory (MB): peak = 3395.078 ; gain = 0.000 ; free physical = 12119 ; free virtual = 36251
Wrote Netlist Cache: Time (s): cpu = 00:00:00.01 ; elapsed = 00:00:00.01 . Memory (MB): peak = 3395.078 ; gain = 0.000 ; free physical = 12121 ; free virtual = 36254
Wrote Device Cache: Time (s): cpu = 00:00:00 ; elapsed = 00:00:00 . Memory (MB): peak = 3395.078 ; gain = 0.000 ; free physical = 12121 ; free virtual = 36254
Write Physdb Complete: Time (s): cpu = 00:00:01 ; elapsed = 00:00:00.62 . Memory (MB): peak = 3395.078 ; gain = 0.000 ; free physical = 12121 ; free virtual = 36254
INFO: [Common 17-1381] The checkpoint '/home/student/s101153258/riscv_microprocessor/riscv_microprocessor.runs/impl_1/system_wrapper_postroute_physopt.dcp' has been generated.
INFO: [Common 17-206] Exiting Vivado at Tue Dec  9 13:20:54 2025...
